{
  "standard": "CERT-C",
  "version": "2016 Edition (wiki current)",
  "extraction_date": "2025-12-31",
  "source": "https://wiki.sei.cmu.edu/confluence/display/c/SEI+CERT+C+Coding+Standard",
  "statistics": {
    "total_guidelines": 306,
    "rules": 123,
    "directives": 0,
    "recommendations": 183,
    "categories": 31
  },
  "categories": [
    {
      "id": "PRE",
      "name": "Preprocessor (PRE)",
      "guidelines": [
        {
          "id": "PRE30-C",
          "title": "Do not create a universal character name through concatenation",
          "guideline_type": "rule"
        },
        {
          "id": "PRE31-C",
          "title": "Avoid side effects in arguments to unsafe macros",
          "guideline_type": "rule"
        },
        {
          "id": "PRE32-C",
          "title": "Do not use preprocessor directives in invocations of function-like macros",
          "guideline_type": "rule"
        }
      ]
    },
    {
      "id": "DCL",
      "name": "Declarations and Initialization (DCL)",
      "guidelines": [
        {
          "id": "DCL30-C",
          "title": "Declare objects with appropriate storage durations",
          "guideline_type": "rule"
        },
        {
          "id": "DCL31-C",
          "title": "Declare identifiers before using them",
          "guideline_type": "rule"
        },
        {
          "id": "DCL36-C",
          "title": "Do not declare an identifier with conflicting linkage classifications",
          "guideline_type": "rule"
        },
        {
          "id": "DCL37-C",
          "title": "Do not declare or define a reserved identifier",
          "guideline_type": "rule"
        },
        {
          "id": "DCL38-C",
          "title": "Use the correct syntax when declaring a flexible array member",
          "guideline_type": "rule"
        },
        {
          "id": "DCL39-C",
          "title": "Avoid information leakage when passing a structure across a trust boundary",
          "guideline_type": "rule"
        },
        {
          "id": "DCL40-C",
          "title": "Do not create incompatible declarations of the same function or object",
          "guideline_type": "rule"
        },
        {
          "id": "DCL41-C",
          "title": "Do not declare variables inside a switch statement before the first case label",
          "guideline_type": "rule"
        },
        {
          "id": "DCL15-C",
          "title": "Declare file-scope objects or functions that do not need external linkage as static",
          "guideline_type": "recommendation"
        },
        {
          "id": "DCL19-C",
          "title": "Use as minimal a scope as possible for all variables and functions",
          "guideline_type": "recommendation"
        }
      ]
    },
    {
      "id": "EXP",
      "name": "Expressions (EXP)",
      "guidelines": [
        {
          "id": "EXP30-C",
          "title": "Do not depend on the order of evaluation for side effects",
          "guideline_type": "rule"
        },
        {
          "id": "EXP32-C",
          "title": "Do not access a volatile object through a nonvolatile reference",
          "guideline_type": "rule"
        },
        {
          "id": "EXP33-C",
          "title": "Do not read uninitialized memory",
          "guideline_type": "rule"
        },
        {
          "id": "EXP34-C",
          "title": "Do not dereference null pointers",
          "guideline_type": "rule"
        },
        {
          "id": "EXP35-C",
          "title": "Do not modify objects with temporary lifetime",
          "guideline_type": "rule"
        },
        {
          "id": "EXP36-C",
          "title": "Do not cast pointers into more strictly aligned pointer types",
          "guideline_type": "rule"
        },
        {
          "id": "EXP37-C",
          "title": "Call functions with the correct number and type of arguments",
          "guideline_type": "rule"
        },
        {
          "id": "EXP39-C",
          "title": "Do not access a variable through a pointer of an incompatible type",
          "guideline_type": "rule"
        },
        {
          "id": "EXP40-C",
          "title": "Do not modify constant objects",
          "guideline_type": "rule"
        },
        {
          "id": "EXP42-C",
          "title": "Do not compare padding data",
          "guideline_type": "rule"
        },
        {
          "id": "EXP43-C",
          "title": "Avoid undefined behavior when using restrict-qualified pointers",
          "guideline_type": "rule"
        },
        {
          "id": "EXP44-C",
          "title": "Do not rely on side effects in operands to sizeof, _Alignof, or _Generic",
          "guideline_type": "rule"
        },
        {
          "id": "EXP45-C",
          "title": "Do not perform assignments in selection statements",
          "guideline_type": "rule"
        },
        {
          "id": "EXP46-C",
          "title": "Do not use a bitwise operator with a Boolean-like operand",
          "guideline_type": "rule"
        },
        {
          "id": "EXP47-C",
          "title": "Do not call va_arg with an argument of the incorrect type",
          "guideline_type": "rule"
        }
      ]
    },
    {
      "id": "INT",
      "name": "Integers (INT)",
      "guidelines": [
        {
          "id": "INT30-C",
          "title": "Ensure that unsigned integer operations do not wrap",
          "guideline_type": "rule"
        },
        {
          "id": "INT31-C",
          "title": "Ensure that integer conversions do not result in lost or misinterpreted data",
          "guideline_type": "rule"
        },
        {
          "id": "INT32-C",
          "title": "Ensure that operations on signed integers do not result in overflow",
          "guideline_type": "rule"
        },
        {
          "id": "INT33-C",
          "title": "Ensure that division and remainder operations do not result in divide-by-zero errors",
          "guideline_type": "rule"
        },
        {
          "id": "INT34-C",
          "title": "Do not shift an expression by a negative number of bits or by greater than or equal to the number of bits that exist in the operand",
          "guideline_type": "rule"
        },
        {
          "id": "INT35-C",
          "title": "Use correct integer precisions",
          "guideline_type": "rule"
        },
        {
          "id": "INT36-C",
          "title": "Converting a pointer to integer or integer to pointer",
          "guideline_type": "rule"
        }
      ]
    },
    {
      "id": "FLP",
      "name": "Floating Point (FLP)",
      "guidelines": [
        {
          "id": "FLP30-C",
          "title": "Do not use floating-point variables as loop counters",
          "guideline_type": "rule"
        },
        {
          "id": "FLP32-C",
          "title": "Prevent or detect domain and range errors in math functions",
          "guideline_type": "rule"
        },
        {
          "id": "FLP34-C",
          "title": "Ensure that floating-point conversions are within range of the new type",
          "guideline_type": "rule"
        },
        {
          "id": "FLP36-C",
          "title": "Preserve precision when converting integral values to floating-point type",
          "guideline_type": "rule"
        },
        {
          "id": "FLP37-C",
          "title": "Do not use object representations to compare floating-point values",
          "guideline_type": "rule"
        }
      ]
    },
    {
      "id": "ARR",
      "name": "Arrays (ARR)",
      "guidelines": [
        {
          "id": "ARR30-C",
          "title": "Do not form or use out-of-bounds pointers or array subscripts",
          "guideline_type": "rule"
        },
        {
          "id": "ARR32-C",
          "title": "Ensure size arguments for variable length arrays are in a valid range",
          "guideline_type": "rule"
        },
        {
          "id": "ARR36-C",
          "title": "Do not subtract or compare two pointers that do not refer to the same array",
          "guideline_type": "rule"
        },
        {
          "id": "ARR37-C",
          "title": "Do not add or subtract an integer to a pointer to a non-array object",
          "guideline_type": "rule"
        },
        {
          "id": "ARR38-C",
          "title": "Guarantee that library functions do not form invalid pointers",
          "guideline_type": "rule"
        },
        {
          "id": "ARR39-C",
          "title": "Do not add or subtract a scaled integer to a pointer",
          "guideline_type": "rule"
        }
      ]
    },
    {
      "id": "STR",
      "name": "Characters and Strings (STR)",
      "guidelines": [
        {
          "id": "STR30-C",
          "title": "Do not attempt to modify string literals",
          "guideline_type": "rule"
        },
        {
          "id": "STR31-C",
          "title": "Guarantee that storage for strings has sufficient space for character data and the null terminator",
          "guideline_type": "rule"
        },
        {
          "id": "STR32-C",
          "title": "Do not pass a non-null-terminated character sequence to a library function that expects a string",
          "guideline_type": "rule"
        },
        {
          "id": "STR34-C",
          "title": "Cast characters to unsigned char before converting to larger integer sizes",
          "guideline_type": "rule"
        },
        {
          "id": "STR37-C",
          "title": "Arguments to character-handling functions must be representable as an unsigned char",
          "guideline_type": "rule"
        },
        {
          "id": "STR38-C",
          "title": "Do not confuse narrow and wide character strings and functions",
          "guideline_type": "rule"
        }
      ]
    },
    {
      "id": "MEM",
      "name": "Memory Management (MEM)",
      "guidelines": [
        {
          "id": "MEM30-C",
          "title": "Do not access freed memory",